{
  "version": 3,
  "updated_at": "2026-06-07T13:00:00Z",
  "mode": "incubating",
  "phase": {
    "id": "P0",
    "name": "Foundations"
  },
  "active_task": null,
  "in_flight_agents": [],
  "subsystems": {
    "GRAPH": { "status": "active", "note": "GRAPH-001 merged: Oxc pipeline (CST/semantic/IR), hand-built incremental memo, single parser (I-1)" },
    "RT": { "status": "planned", "note": "RT-001 (embed V8, deno_core 0.403) next; RT-002 after; RT-003 after GRAPH (ready)" },
    "LOAD": { "status": "planned", "note": "LOAD-001 unblocked (GRAPH + PKG merged)" },
    "PKG": { "status": "active", "note": "PKG-001 merged: meow.lock.jsonl + content-addressed cache" },
    "WS": { "status": "planned", "note": "monorepo graph discovery + linking (P4)" },
    "TASK": { "status": "planned", "note": "typed tasks, in/out hashing, artifact->task (P4)" },
    "TEST": { "status": "planned", "note": "isolate-per-file, deterministic clock (P6)" },
    "TOOL": { "status": "planned", "note": "lint/format/bundle over shared graph (P3)" },
    "CHK": { "status": "planned", "note": "delegated tsc/tsgo daemon (P3)" },
    "LSP": { "status": "planned", "note": "shared resolver + shadow symlink map (P2)" },
    "SEC": { "status": "planned", "note": "capability tiers, provenance (P6/P7)" },
    "OBS": { "status": "planned", "note": "why-slow/large/dep, trace, doctor (P6)" },
    "CFG": { "status": "active", "note": "CFG-001 merged: defineMeow + shadow tsconfig + meow sync" },
    "DIST": { "status": "active", "note": "DIST-001 merged: Cargo workspace + meow CLI skeleton" },
    "H": { "status": "planned", "note": "harness chores: hooks, CI, docs" }
  },
  "waves": [
    { "id": 1, "specs": ["DIST-001"], "outcome": "merged" },
    { "id": 2, "specs": ["PKG-001", "CFG-001"], "outcome": "merged" },
    { "id": 3, "specs": ["GRAPH-001"], "outcome": "merged" }
  ],
  "gates": {
    "footprint": { "status": "green", "at": "2026-06-07T10:05:00Z", "evidence_ref": "harness/reality-checks/footprint-1.md" },
    "craft": { "status": "green", "at": "2026-06-07T13:00:00Z", "evidence_ref": "harness/reality-checks/craft-2.md" }
  },
  "drift_flags": [],
  "decisions": {
    "open": 0,
    "max_severity": "none",
    "needs_input": 0,
    "ref": "decisions.json"
  },
  "resume_pointer": {
    "read": [
      "harness/state.json",
      "harness/CHANGELOG.md",
      "harness/decisions.json",
      "harness/PLAN.md",
      "harness/CANON.md"
    ],
    "active": "P0 Foundations — DIST/PKG/CFG/GRAPH-001 merged (workspace, lockfile+cache, config+sync, parse pipeline). Floor + craft green.",
    "next_pull_hint": "RT-001 (embed V8, deno_core 0.403 — V8 fetch de-risked); then RT-003 + LOAD-001 (GRAPH+PKG ready), RT-002 (after RT-001). Craft-gate each."
  }
}
